Seed Round - Somatic,https://www.crunchbase.com/funding_round/somatic-bf50-seed--260c542e,Somatic,https://www.crunchbase.com/organization/somatic-bf50,Seed,150000,USD,150000,2020-03-16,,,,Somatic makes bathroom cleaning robots for commercial spaces like office buildings.,"Artificial Intelligence, Consumer Electronics, Robotics","New York, New York, United States, North America",http://getsomatic.com,,Seed,"Pioneer Fund, SOSV, Y Combinator"
Seed Round - Felix Biotechnology,https://www.crunchbase.com/funding_round/felix-biotechnology-seed--b3d846b7,Felix Biotechnology,https://www.crunchbase.com/organization/felix-biotechnology,Seed,150000,USD,150000,2020-03-16,,,,Felix Biotechnology is working to accelerate the deployment of novel biotherapeutics to manage infectious diseases.,"Biopharma, Biotechnology, Health Care, Therapeutics","San Francisco, California, United States, North America",https://www.felixbt.com/,Less than $1M,Seed,"Pioneer Fund, Y Combinator"
Seed Round - yearend.,https://www.crunchbase.com/funding_round/yearend-seed--e6677c23,yearend.,https://www.crunchbase.com/organization/yearend,Seed,1500000,USD,1500000,2020-03-16,,,,YearEnd is software that helps startup employees to optimize their equity and taxes in real-time.,"Accounting, Financial Services, FinTech, SaaS, Software","San Francisco, California, United States, North America",https://yearend.com/,Less than $1M,Seed,"Daintree.VC, Elysium Venture Capital, Gradient Ventures, Raphael Danilo, Soma Capital, Y Combinator"
Seed Round - Spenny,https://www.crunchbase.com/funding_round/spenny-seed--93e6bb1c,Spenny,https://www.crunchbase.com/organization/spenny,Seed,150000,USD,150000,2020-03-16,,,,Spenny offers an easy and fast way to save and invest money.,"Asset Management, FinTech, Personal Finance","Bangalore, Karnataka, India, Asia",http://spennyapp.com/,,Seed,"Edward Lando, Y Combinator"
Seed Round - Virgil Insurance,https://www.crunchbase.com/funding_round/virgil-insurance-seed--3f2894a8,Virgil Insurance,https://www.crunchbase.com/organization/virgil-insurance,Seed,150000,USD,150000,2020-03-16,,,,Virgil Insurance builds new experiences for seniors to shop for health insurance online.,"Health Care, Health Insurance, Insurance","Oakland, California, United States, North America",https://www.virgilinsurance.com/,,Seed,Y Combinator
Seed Round - Exosonic,https://www.crunchbase.com/funding_round/exosonic-seed--08cc40a9,Exosonic,https://www.crunchbase.com/organization/exosonic,Seed,150000,USD,150000,2020-03-16,,,,Exosonic builds a passenger aircraft that can fly super-sonically overland and overwater with a muted sonic boom.,"Aerospace, Air Transportation","Los Angeles, California, United States, North America",https://exosonic.com/,Less than $1M,Seed,Y Combinator
Seed Round - Dashworks,https://www.crunchbase.com/funding_round/dashworks-seed--240af51a,Dashworks,https://www.crunchbase.com/organization/dashworks,Seed,150000,USD,150000,2020-03-16,,,,Dashworks is a software company that brings together all of the information from various collaboration tools and databases.,"Information Technology, Software","Palo Alto, California, United States, North America",http://www.dashworks.ai/,Less than $1M,Seed,Y Combinator
Seed Round - API Tracker,https://www.crunchbase.com/funding_round/apitracker-seed--e4042fdf,API Tracker,https://www.crunchbase.com/organization/apitracker,Seed,150000,USD,150000,2020-03-16,,,,API Tracker is a software company that specializes in tracking and managing APIs.,"Developer APIs, Information Technology, Software","Mountain View, California, United States, North America",https://apitracker.com/,Less than $1M,Seed,"FundersClub, Lombardstreet Ventures, Soma Capital, Y Combinator"
Seed Round - Dataline,https://www.crunchbase.com/funding_round/dataline-9553-seed--98308379,Dataline,https://www.crunchbase.com/organization/dataline-9553,Seed,150000,USD,150000,2020-03-16,,,,"Dataline is an AI platform that provides access to ad-blocked customer data on marketing, customer support, and analytics tools.","Analytics, Artificial Intelligence, Information Technology","San Francisco, California, United States, North America",https://dataline.io/,,Seed,"Rebel Fund, Y Combinator"
Pre Seed Round - PostHog,https://www.crunchbase.com/funding_round/posthog-pre-seed--62e619a9,PostHog,https://www.crunchbase.com/organization/posthog,Pre-Seed,150000,USD,150000,2020-03-16,,,,"Open source product analytics. Track every event with a one line install, and stay in control of all your data, featuring hedgehogs.","Analytics, Open Source, Software, Software Engineering","San Francisco, California, United States, North America",https://posthog.com,,Early Stage Venture,"1984 Ventures, Y Combinator"
Pre Seed Round - Jitter,https://www.crunchbase.com/funding_round/snack-this-pre-seed--4961387f,Jitter,https://www.crunchbase.com/organization/snack-this,Pre-Seed,150000,USD,150000,2020-03-16,,,,A simple motion design tool on the web,"Animation, Graphic Design, Software, UX Design, Video, Web Design","Paris, Ile-de-France, France, Europe",https://jitter.video,,Seed,"Eduardo Ronzano, Y Combinator"
Seed Round - ditto,https://www.crunchbase.com/funding_round/ditto-8d66-seed--d06f7761,ditto,https://www.crunchbase.com/organization/ditto-8d66,Seed,150000,USD,150000,2020-03-16,,,,Ditto allows teams to collaborate on consistent and effective copy.,"Collaboration, Product Design, Software, UX Design","San Francisco, California, United States, North America",http://dittowords.com,,Seed,"Lombardstreet Ventures, Y Combinator"
Seed Round - Altay Therapeutics,https://www.crunchbase.com/funding_round/altay-therapeutics-seed--206e3a66,Altay Therapeutics,https://www.crunchbase.com/organization/altay-therapeutics,Seed,150000,USD,150000,2020-03-16,,,,Altay Therapeutics is a biotech company focused on finding and discovering small molecule therapies for chronic inflammatory conditions.,"Biotechnology, Life Science, Therapeutics","San Francisco, California, United States, North America",https://www.altaytherapeutics.com/,Less than $1M,Seed,"Erik Peterson, Y Combinator"
Pre Seed Round - Hideout,https://www.crunchbase.com/funding_round/hideout-aaf7-pre-seed--00b1a8fe,Hideout,https://www.crunchbase.com/organization/hideout-aaf7,Pre-Seed,150000,USD,150000,2020-03-16,,,,Hideout makes high-quality food that is available for delivery.,"Food and Beverage, Food Delivery, Food Processing","Los Angeles, California, United States, North America",http://findhideout.com/,,Seed,"Erik Peterson, Y Combinator"
Seed Round - GIGI Benefits,https://www.crunchbase.com/funding_round/gigi-benefits-seed--eeb8cfa0,GIGI Benefits,https://www.crunchbase.com/organization/gigi-benefits,Seed,150000,USD,150000,2020-03-16,,,,GIGI Benefits offers full-time employment related benefits like insurance and savings to freelancers and gig workers.,"Employee Benefits, Finance, Financial Services, Insurance","Bangalore, Karnataka, India, Asia",https://gigibenefits.com/,,Seed,Y Combinator
Pre Seed Round - Orbiter,https://www.crunchbase.com/funding_round/orbiter-36f1-pre-seed--f4b1de8f,Orbiter,https://www.crunchbase.com/organization/orbiter-36f1,Pre-Seed,,,,2020-03-16,,,,Orbiter software builds machine learning models to analyze business metrics and detect abnormal changes automatically.,"Analytics, Big Data, Machine Learning, Predictive Analytics, Software","San Francisco, California, United States, North America",https://www.getorbiter.com,,Seed,Y Combinator
Seed Round - Brokrete,https://www.crunchbase.com/funding_round/brokrete-seed--5e091e02,Brokrete,https://www.crunchbase.com/organization/brokrete,Seed,150000,USD,150000,2020-03-16,,,,Storefront solution for construction commodities,"Apps, Construction, Delivery, Landscaping, Software","Toronto, Ontario, Canada, North America",http://brokrete.com/,$1M to $10M,Seed,Y Combinator
Pre Seed Round - Castodia,https://www.crunchbase.com/funding_round/castodia-pre-seed--a7b66398,Castodia,https://www.crunchbase.com/organization/castodia,Pre-Seed,150000,USD,150000,2020-03-16,,,,"Castodia connects spreadsheets to live databases, APIs, and data warehouses to simplify data analysis.","Analytics, Artificial Intelligence, Business Intelligence, Database, Predictive Analytics","San Francisco, California, United States, North America",https://castodia.com,$1M to $10M,Seed,Y Combinator
Seed Round - Breezeful,https://www.crunchbase.com/funding_round/breezeful-seed--1062973d,Breezeful,https://www.crunchbase.com/organization/breezeful,Seed,150000,USD,150000,2020-03-16,,,,Breezeful is an online mortgage brokering platform that helps to reduce the mortgage financing.,"Finance, Financial Services, FinTech, Real Estate","Toronto, Ontario, Canada, North America",https://breezeful.com/,,Seed,Y Combinator
Seed Round - 1build,https://www.crunchbase.com/funding_round/1build-seed--604fe3f0,1build,https://www.crunchbase.com/organization/1build,Seed,150000,USD,150000,2020-03-16,,,,1build utilizes machine intelligence to convert building blueprints into material shopping lists and cost estimates.,"Artificial Intelligence, Construction, Machine Learning","Mountain View, California, United States, North America",https://www.1build.com/,,Seed,Y Combinator
Seed Round - Okay,https://www.crunchbase.com/funding_round/okay-seed--3a5a19b6,Okay,https://www.crunchbase.com/organization/okay,Seed,150000,USD,150000,2020-03-16,,,,Okay helps leaders run high-performing teams with dashboards and user-friendly workflows,"Business Intelligence, Developer Tools, Internet, Productivity Tools, Software","San Francisco, California, United States, North America",https://www.okayhq.com/,,Seed,Y Combinator
Seed Round - Pulley,https://www.crunchbase.com/funding_round/pulley-seed--a877d101,Pulley,https://www.crunchbase.com/organization/pulley,Seed,150000,USD,150000,2020-03-16,,,,"Pulley offers a cap table management platform designed to help startup founders, employees, and investors monitor their equity information.","Financial Services, FinTech, Information Services, Software","San Francisco, California, United States, North America",https://pulley.com/,$1M to $10M,Early Stage Venture,Y Combinator
Pre Seed Round - Deep Meditate,https://www.crunchbase.com/funding_round/deep-meditate-pre-seed--950d8ed7,Deep Meditate,https://www.crunchbase.com/organization/deep-meditate,Pre-Seed,150000,USD,150000,2020-03-16,,,,Deep Meditate is a mental fitness application platform that helps its users in meditation.,"Apps, Fitness, Health Care, Wellness","Walnut, California, United States, North America",https://deepmeditate.com,,Seed,Y Combinator
Seed Round - Alude,https://www.crunchbase.com/funding_round/alude-seed--3fb3862f,Alude,https://www.crunchbase.com/organization/alude,Seed,150000,USD,150000,2020-03-16,,,,Alude is a database company that simplifies the process of buying and leasing of real-estate.,"Database, Real Estate, Software","São Paulo, Sao Paulo, Brazil, South America",https://www.alude.com.br/,$1M to $10M,Seed,Y Combinator
Seed Round - Flowbot,https://www.crunchbase.com/funding_round/flowbot-seed--37472a76,Flowbot,https://www.crunchbase.com/organization/flowbot,Seed,150000,USD,150000,2020-03-16,,,,Flowbot is a natural language-driven programming assistant that helps users code faster.,"Artificial Intelligence, Developer Tools, Information Technology, Productivity Tools","New York, New York, United States, North America",https://www.getflowbot.com/,,Seed,Y Combinator
Pre Seed Round - Potential,https://www.crunchbase.com/funding_round/potential-6d18-pre-seed--5ef911cb,Potential,https://www.crunchbase.com/organization/potential-6d18,Pre-Seed,150000,USD,150000,2020-03-16,,,,Potential works to secure employment and security for those exiting the criminal justice system.,"Corrections Facilities, Government, Humanitarian","San Francisco, California, United States, North America",http://findpotential.org/,,Seed,Y Combinator
Pre Seed Round - RoboTire,https://www.crunchbase.com/funding_round/robotire-pre-seed--38dc1043,RoboTire,https://www.crunchbase.com/organization/robotire,Pre-Seed,150000,USD,150000,2020-03-16,,,,RoboTire automates vehicle maintenance by combining robots and computer vision.,"Artificial Intelligence, Automotive, Autonomous Vehicles, Computer Vision, Industrial Automation, Machine Learning, Robotics, Software","San Carlos, California, United States, North America",https://robotire.com,Less than $1M,Seed,Y Combinator
Seed Round - ZeFi,https://www.crunchbase.com/funding_round/zefi-seed--42e96068,ZeFi,https://www.crunchbase.com/organization/zefi,Seed,150000,USD,150000,2020-03-16,,,,ZeFi develops a neobanking platform that provides a permission less financial ecosystem without a central authority.,"Asset Management, Banking, Cryptocurrency, Debit Cards, Financial Services, FinTech, Software","San Francisco, California, United States, North America",https://zefi.io,,Seed,Y Combinator
Venture Round - Datree,https://www.crunchbase.com/funding_round/datree-io-series-unknown--f6ccea41,Datree,https://www.crunchbase.com/organization/datree-io,Venture - Series Unknown,150000,USD,150000,2020-03-16,,,,Datree is a git-based policy engine for engineering teams to enforce coding standards and security policies within their git workflow.,"Cloud Computing, Developer Tools, Internet, Productivity Tools","San Francisco, California, United States, North America",https://www.datree.io,Less than $1M,,Y Combinator
Seed Round - Weav,https://www.crunchbase.com/funding_round/weav-ca78-seed--ec5c104e,Weav,https://www.crunchbase.com/organization/weav-ca78,Seed,150000,USD,150000,2020-03-16,,,,Weav is a fintech infrastructure company.,FinTech,"New York, New York, United States, North America",https://weav.co/,,Seed,Y Combinator
Seed Round - Candid Health,https://www.crunchbase.com/funding_round/candid-health-seed--d4a3fe75,Candid Health,https://www.crunchbase.com/organization/candid-health,Seed,150000,USD,150000,2020-03-16,,,,Candid Health is a platform that uses AI for automated medical billing.,"Artificial Intelligence, Health Care, Medical","San Francisco, California, United States, North America",https://www.joincandidhealth.com/,Less than $1M,Seed,Y Combinator
Seed Round - Snapboard,https://www.crunchbase.com/funding_round/snapboard-8104-seed--e7c5607d,Snapboard,https://www.crunchbase.com/organization/snapboard-8104,Seed,150000,USD,150000,2020-03-16,,,,"Snapboard is a software house that allows users to manage and link apps and platforms in a single, customizable dashboard.","Apps, Software, Software Engineering, Web Apps","London, England, United Kingdom, Europe",https://snapboard.io,,Seed,Y Combinator
Seed Round - Explo,https://www.crunchbase.com/funding_round/explo-seed--b419b2a6,Explo,https://www.crunchbase.com/organization/explo,Seed,150000,USD,150000,2020-03-16,,,,Embedded customer-facing analytics - lightning fast,"Analytics, Big Data, Data Visualization, Database, SaaS, Software","San Francisco, California, United States, North America",https://explo.co/,,Seed,"Soma Capital, Y Combinator"
Pre Seed Round - Modern Village,https://www.crunchbase.com/funding_round/modern-village-pre-seed--89cb84c5,Modern Village,https://www.crunchbase.com/organization/modern-village,Pre-Seed,150000,USD,150000,2020-03-16,,,,We're building the FamilyOS - software that lightens the load of running a family.,"Children, Parenting","Alexandria, Virginia, United States, North America",http://www.modernvillage.com/,,Seed,Y Combinator
Seed Round - Upflow,https://www.crunchbase.com/funding_round/upflow-seed--e0396d44,Upflow,https://www.crunchbase.com/organization/upflow,Seed,150000,USD,150000,2020-03-16,,,,Upflow is a technology company building a payment platform for B2B businesses.,"B2B, Billing, E-Commerce Platforms, Financial Services, FinTech, Payments, SaaS, Software","Paris, Ile-de-France, France, Europe",https://www.upflow.io,Less than $1M,Seed,Y Combinator
Series B - Proxy,https://www.crunchbase.com/funding_round/martians-series-b--e9a966a5,Proxy,https://www.crunchbase.com/organization/martians,Series B,42000000,USD,42000000,2020-03-16,,,,Proxy provides a smartphone-enabled digital identity that allows the user to authenticate and interact with all devices.,"Augmented Reality, Blockchain, Consumer, Identity Management, Information Technology, Mobile, Mobile Apps, Software","San Francisco, California, United States, North America",https://proxy.com/,$1M to $10M,Early Stage Venture,"Kleiner Perkins, Scale Venture Partners, Silicon Valley Bank, West, Y Combinator"
Venture Round - YukStay,https://www.crunchbase.com/funding_round/yukstay-series-unknown--17170429,YukStay,https://www.crunchbase.com/organization/yukstay,Venture - Series Unknown,150000,USD,150000,2020-03-16,,,,YukStay is a Real Estate company that helps people to find their desire appartment.,"Building Material, E-Commerce, Internet, Marketplace, Real Estate","Jakarta, Jakarta Raya, Indonesia, Asia",https://www.yukstay.com/,$1M to $10M,M&A,Y Combinator
Seed Round - Trimwire,https://www.crunchbase.com/funding_round/trimwire-seed--fb739a76,Trimwire,https://www.crunchbase.com/organization/trimwire,Seed,150000,USD,150000,2020-03-16,,,,Trimwire is a fintech platform that monitors spending and applies discounts to recurring expenses.,"B2B, Financial Services, FinTech, Information Technology, SaaS","Mountain View, California, United States, North America",https://trimwire.com,,Seed,Y Combinator
Pre Seed Round - BuildBuddy,https://www.crunchbase.com/funding_round/buildbuddy-pre-seed--00168810,BuildBuddy,https://www.crunchbase.com/organization/buildbuddy,Pre-Seed,150000,USD,150000,2020-03-16,,,,"BuildBuddy provides enterprise features for Bazel, an open-source build system that allows companies to build and test software faster.","Enterprise Software, Open Source, Software","Palo Alto, California, United States, North America",https://buildbuddy.io/,,Seed,Y Combinator
Seed Round - Flowdash,https://www.crunchbase.com/funding_round/flowdash-seed--4353e33d,Flowdash,https://www.crunchbase.com/organization/flowdash,Seed,150000,USD,150000,2020-03-16,,,,Flowdash helps users in developing internal tools to track and execute human-in-the-loop workflows.,"Information Technology, Productivity Tools, Software","San Francisco, California, United States, North America",https://flowdash.com/,,Seed,Y Combinator
Seed Round - Terusama,https://www.crunchbase.com/funding_round/terusama-seed--9d14b7a6,Terusama,https://www.crunchbase.com/organization/terusama,Seed,150000,USD,150000,2020-03-16,,,,"Terusama is a virtual logistics coordinator that offers self-service dock scheduling, digital driver check-in, and automated workflows.","Autonomous Vehicles, Information Technology, Internet, Logistics, Operating Systems, SaaS, Software, Transportation, Warehousing","San Francisco, California, United States, North America",https://terusama.com,$1M to $10M,Seed,Y Combinator
Seed Round - TrueNorth,https://www.crunchbase.com/funding_round/truenorth-seed--bf8c4bea,TrueNorth,https://www.crunchbase.com/organization/truenorth,Seed,150000,USD,150000,2020-03-16,,,,"TrueNorth offers software that helps truckers manage insurance, fuel, and maintenance.","Logistics, Software, Transportation","San Francisco, California, United States, North America",https://www.truenorthfleet.com/,,Seed,Y Combinator
Seed Round - Motion,https://www.crunchbase.com/funding_round/motion-f1df-seed--4a4c35cd,Motion,https://www.crunchbase.com/organization/motion-f1df,Seed,150000,USD,150000,2020-03-16,,,,"Motion provides real-time interventions, reminders, and analytic, preventing people from getting distracted on the web.","Analytics, Productivity Tools, Real Time, Software","Sacramento, California, United States, North America",https://www.inmotion.app/,,Seed,Y Combinator
Pre Seed Round - Multiverse,https://www.crunchbase.com/funding_round/multiverse-adb5-pre-seed--d3b8bf7e,Multiverse,https://www.crunchbase.com/organization/multiverse-adb5,Pre-Seed,150000,USD,150000,2020-03-16,,,,Multiverse is a web-based social game and game creation platform.,"Casual Games, Marketplace, Online Games","Boston, Massachusetts, United States, North America",http://www.playmultiverse.com,,Seed,Y Combinator
Pre Seed Round - ToDesktop,https://www.crunchbase.com/funding_round/todesktop-pre-seed--efdb4aae,ToDesktop,https://www.crunchbase.com/organization/todesktop,Pre-Seed,150000,USD,150000,2020-03-16,,,,ToDesktop enables web businesses to convert their web app into a desktop app.,"B2B, Computer, Desktop Apps, Software, Web Apps","Cork, Cork, Ireland, Europe",https://www.todesktop.com,,Seed,Y Combinator
Seed Round - Mistro,https://www.crunchbase.com/funding_round/mistro-seed--b9b80e80,Mistro,https://www.crunchbase.com/organization/mistro,Seed,150000,USD,150000,2020-03-16,,,,Mistro offers a platform that provides unique benefits plan to each remote employee.,"Developer Platform, Employee Benefits, Human Resources","San Francisco, California, United States, North America",https://mistro.io/,$1M to $10M,Seed,Y Combinator
Seed Round - Daedalus,https://www.crunchbase.com/funding_round/daedalus-6017-seed--174fb9b0,Daedalus,https://www.crunchbase.com/organization/daedalus-6017,Seed,150000,USD,150000,2020-03-16,,,,Daedalus is a technology company that develops and reconfigurable production capacity for the automated production of small series.,"Artificial Intelligence, Manufacturing, Robotics","Grundau, Sachsen, Germany, Europe",https://daedalus.de/,$1M to $10M,Seed,Y Combinator
Pre Seed Round - CARUPI,https://www.crunchbase.com/funding_round/carupi-pre-seed--193539d6,CARUPI,https://www.crunchbase.com/organization/carupi,Pre-Seed,150000,USD,150000,2020-03-16,,,,"Managed marketplace for used cars, similar to Airbnb.",Marketplace,"São Paulo, Sao Paulo, Brazil, South America",https://www.carupi.com/,,Seed,Y Combinator
Seed Round - Cortex,https://www.crunchbase.com/funding_round/cortex-98f5-seed--135cd1ac,Cortex,https://www.crunchbase.com/organization/cortex-98f5,Seed,150000,USD,150000,2020-03-16,,,,Cortex is a software platform that manages and operates microservices.,"Document Management, Information Technology, Software","San Francisco, California, United States, North America",https://getcortexapp.com/,,Seed,Y Combinator
Seed Round - The Mercer Club,https://www.crunchbase.com/funding_round/the-mercer-club-seed--09f90709,The Mercer Club,https://www.crunchbase.com/organization/the-mercer-club,Seed,150000,USD,150000,2020-03-16,,,,The Mercer Club is an online rental marketplace for luxury clothing.,"Fashion, Marketplace, Online Portals","New York, New York, United States, North America",https://www.themercerclubnyc.com/,$1M to $10M,Seed,Y Combinator
Seed Round - Ardis AI,https://www.crunchbase.com/funding_round/ardis-ai-seed--cfeef0e2,Ardis AI,https://www.crunchbase.com/organization/ardis-ai,Seed,150000,USD,150000,2020-03-16,,,,Ardis AI develops a toolkit that extracts structured information from raw text.,"Artificial Intelligence, Developer Tools, Information Services, Natural Language Processing, Software","Columbus, Ohio, United States, North America",https://www.ardis.ai/,,Seed,Y Combinator
Pre Seed Round - Whatnot,https://www.crunchbase.com/funding_round/whatnot-pre-seed--cd456fe5,Whatnot,https://www.crunchbase.com/organization/whatnot,Pre-Seed,150000,USD,150000,2020-03-16,,,,"Whatnot is a live stream platform and marketplace that enables collectors and enthusiasts to connect, buy, and sell verified products.","Collectibles, E-Commerce, Marketplace, Trading Platform","Marina Del Rey, California, United States, North America",https://www.whatnot.com,Less than $1M,Early Stage Venture,Y Combinator
Seed Round - Kosh,https://www.crunchbase.com/funding_round/kosh-seed--aca62789,Kosh,https://www.crunchbase.com/organization/kosh,Seed,150000,USD,150000,2020-03-16,,,,Kosh is a financial services platform designed to help people become financially independent.,"Financial Services, FinTech, Machine Learning, Software","Gurgaon, Haryana, India, Asia",https://getkosh.com/,Less than $1M,Seed,Y Combinator
Seed Round - Fondeadora,https://www.crunchbase.com/funding_round/fondeadora-seed--3c3ef701,Fondeadora,https://www.crunchbase.com/organization/fondeadora,Seed,150000,USD,150000,2020-03-16,,,,Fondeadora is a digital banking services company that aims to eliminate the inefficiencies related to the traditional banking system.,"Banking, Crowdfunding, Crowdsourcing, Debit Cards, Financial Services, FinTech, Internet","Mexico City, Distrito Federal, Mexico, North America",https://fondeadora.com,$1M to $10M,Early Stage Venture,Y Combinator
Seed Round - delt.ai,https://www.crunchbase.com/funding_round/delt-ai-seed--2f66c80e,delt.ai,https://www.crunchbase.com/organization/delt-ai,Seed,150000,USD,150000,2020-03-16,,,,Delt.ai develops an AI-powered platform that manages finances from transactions to records.,"Artificial Intelligence, Banking, Financial Services, FinTech, Machine Learning, Productivity Tools, Software","Mexico City, Distrito Federal, Mexico, North America",http://delt.ai,,Seed,Y Combinator
Seed Round - Skypher,https://www.crunchbase.com/funding_round/skypher-seed--c7361a07,Skypher,https://www.crunchbase.com/organization/skypher,Seed,150000,USD,150000,2020-03-16,,,,Skypher automates security questionnaires response in the sales process.,"Information Services, Information Technology, SaaS, Software","Paris, Ile-de-France, France, Europe",https://skypher.co/,$1M to $10M,Seed,Y Combinator
Pre Seed Round - SINAI Technologies,https://www.crunchbase.com/funding_round/sinai-pre-seed--47a61bd1,SINAI Technologies,https://www.crunchbase.com/organization/sinai,Pre-Seed,150000,USD,150000,2020-03-16,,,,"The world’s leading enterprise decarbonization software. Built to measure, analyze, price, and reduce emissions.","Enterprise Software, Information Technology, Software","San Francisco, California, United States, North America",http://www.sinaitechnologies.com,Less than $1M,Seed,Y Combinator
