Seed Round - Cuboh,https://www.crunchbase.com/funding_round/cuboh-seed--1ce291fe,Cuboh,https://www.crunchbase.com/organization/cuboh,Seed,150000,USD,150000,2019-08-19,,,,Cuboh is a developer of an application intended to automate online food orders for restaurants.,"CRM, E-Commerce, Information Technology, Internet, iOS, Software","Victoria, British Columbia, Canada, North America",http://www.cuboh.com,,Seed,"AltaIR Capital, Angel Forum, E-Fund, Y Combinator"
Pre Seed Round - Holy Grail,https://www.crunchbase.com/funding_round/holy-grail-pre-seed--0346bb4a,Holy Grail,https://www.crunchbase.com/organization/holy-grail,Pre-Seed,150000,USD,150000,2019-08-19,,,,Holy Grail builds automatic probabilistic Deep Learning for impactful research and optimization problems,"Artificial Intelligence, Life Science, Machine Learning","San Francisco, California, United States, North America",https://www.holygrail.ai/,Less than $1M,Seed,"Deep Science Ventures, Otherwise Fund, Y Combinator"
Seed Round - Flo Recruit,https://www.crunchbase.com/funding_round/flo-recruit-seed--cfab4690,Flo Recruit,https://www.crunchbase.com/organization/flo-recruit,Seed,1150000,USD,1150000,2019-08-19,,,,"Personal, human recruiting at scale.","College Recruiting, Human Resources, Recruiting, SaaS","Austin, Texas, United States, North America",http://florecruit.com,Less than $1M,Seed,"LiveOak Venture Partners, Y Combinator"
Seed Round - Localyze,https://www.crunchbase.com/funding_round/localyze-seed--285785c9,Localyze,https://www.crunchbase.com/organization/localyze,Seed,1300000,USD,1300000,2019-08-19,,,,"The all-in-one software to manage your international team: Relocate international hires, temporarily transfer employees & contract remotely","Information Technology, Internet, SaaS, Software","Hamburg, Hamburg, Germany, Europe",https://www.localyzeapp.com,Less than $1M,Seed,"Auxxo, Frontline Ventures, Giovanni Gardelli, Patrick Cettier, Y Combinator"
Seed Round - Ever Loved,https://www.crunchbase.com/funding_round/ever-loved-seed--b556b29e,Ever Loved,https://www.crunchbase.com/organization/ever-loved,Seed,150000,USD,150000,2019-08-19,,,,"Ever Loved helps people navigate the funeral process from end-to-end, reducing stress and lowering costs.",Funerals,"San Francisco, California, United States, North America",https://everloved.com,$10M to $50M,Seed,"AltaIR Capital, Christer Andersson, Coughdrop Capital, Recursive Ventures, Y Combinator"
Seed Round - Narrator,https://www.crunchbase.com/funding_round/ai-narrator-seed--8fd50dec,Narrator,https://www.crunchbase.com/organization/ai-narrator,Seed,6103213,USD,6103213,2019-08-19,,,,"Analyses built by experts, delivered in minutes","Analytics, Artificial Intelligence, Education","New York, New York, United States, North America",https://www.narrator.ai,,Early Stage Venture,Y Combinator
Seed Round - Curtsy,https://www.crunchbase.com/funding_round/curtsy-seed--64d4c1cc,Curtsy,https://www.crunchbase.com/organization/curtsy,Seed,150000,USD,150000,2019-08-19,,,,"Curtsy is an app that lets women buy and sell clothing, shoes, and accessories on their phone.","E-Commerce, Fashion, Mobile Apps, Shopping, Women's","San Francisco, California, United States, North America",http://www.curtsyapp.com/,Less than $1M,Early Stage Venture,"1984 Ventures, Nitesh Banta, Unpopular Ventures, Y Combinator"
Pre Seed Round - Nonu Care,https://www.crunchbase.com/funding_round/nonu-care-pre-seed--fdb968d3,Nonu Care,https://www.crunchbase.com/organization/nonu-care,Pre-Seed,150000,USD,150000,2019-08-19,,,,India's most authentic men's wellness brand,"Health Care, Wellness","Palo Alto, California, United States, North America",https://nonucare.com/,$1M to $10M,Seed,Y Combinator
Seed Round - Microverse,https://www.crunchbase.com/funding_round/microverse-seed--0613bc55,Microverse,https://www.crunchbase.com/organization/microverse,Seed,,,,2019-08-19,,,,An online school for remote software developers that costs nothing until you get a job,"Education, Internet, Software","San Francisco, California, United States, North America",https://www.microverse.org/,$10M to $50M,Seed,"Esas Ventures, Y Combinator"
Seed Round - MiPOSDev,https://www.crunchbase.com/funding_round/miposdev-seed--d57cfbf1,MiPOSDev,https://www.crunchbase.com/organization/miposdev,Seed,,,,2019-08-19,,,,"MiPOSDev manages its clients' inventory, billing, and processes.","Apps, Restaurants, Software","Quito, Pichincha, Ecuador, South America",https://www.mipos.dev/,,Seed,"Esas Ventures, Y Combinator"
Seed Round - Data Mechanics,https://www.crunchbase.com/funding_round/data-mechanics-seed--bf79efda,Data Mechanics,https://www.crunchbase.com/organization/data-mechanics,Seed,150000,USD,150000,2019-08-19,,,,A serverless platform for data engineering and data science. The Simplest Way To Run Apache Spark.,"Big Data, Computer, Information Technology, Software","San Francisco, California, United States, North America",https://www.datamechanics.co/,,Seed,"Eduardo Ronzano, Guillaume Lestrade, Y Combinator"
Pre Seed Round - Lantern,https://www.crunchbase.com/funding_round/lantern-5046-pre-seed--5e8c496b,Lantern,https://www.crunchbase.com/organization/lantern-5046,Pre-Seed,150000,USD,150000,2019-08-19,,,,Lantern provides user behavior monitoring for modern product teams.,"Cyber Security, Information Technology, Network Security, Security","San Francisco, California, United States, North America",https://www.lantern.so/,Less than $1M,Seed,Y Combinator
Pre Seed Round - Asher Bio,https://www.crunchbase.com/funding_round/asher-bio-pre-seed--db2f354d,Asher Bio,https://www.crunchbase.com/organization/asher-bio,Pre-Seed,150000,USD,150000,2019-08-19,,,,Asher Bio is a biotechnology company that specializes in the fields of therapeutics builds better immunotherapy for cancer.,"Biotechnology, Therapeutics","San Francisco, California, United States, North America",https://www.asherbio.com/,,Early Stage Venture,"Evan Cheng, Y Combinator"
Seed Round - Gaiascope,https://www.crunchbase.com/funding_round/gaiascope-seed--7430cb7f,Gaiascope,https://www.crunchbase.com/organization/gaiascope,Seed,2318000,USD,2318000,2019-08-19,,,,Gaiascope helps energy companies and investors transition to the future in the most economic way possible.,"CleanTech, Energy, Machine Learning, Power Grid, Software, Sustainability","Boston, Massachusetts, United States, North America",https://www.gaia-scope.com/,,Seed,"ACE Investment Partners Ltd., Jon Soberg, Y Combinator"
Pre Seed Round - KubeSail,https://www.crunchbase.com/funding_round/kubesail-pre-seed--2a744ff2,KubeSail,https://www.crunchbase.com/organization/kubesail,Pre-Seed,150000,USD,150000,2019-08-19,,,,Easy to use Kubernetes PaaS for individual developers and small teams!,"Cloud Infrastructure, Software, Web Hosting","San Francisco, California, United States, North America",https://kubesail.com,Less than $1M,Seed,Y Combinator
Pre Seed Round - Trella,https://www.crunchbase.com/funding_round/trella-pre-seed--15ea2565,Trella,https://www.crunchbase.com/organization/trella,Pre-Seed,150000,USD,150000,2019-08-19,,,,Trella is a b2b technology platform and trucking marketplace that connects shippers with carriers in the highly fragmented freight industry,"Marketplace, Shipping, Transportation","Cairo, Al Qahirah, Egypt, Africa",https://www.trella.app/,$1M to $10M,Early Stage Venture,Y Combinator
Pre Seed Round - CoLab Software,https://www.crunchbase.com/funding_round/colab-software-pre-seed--ead252b1,CoLab Software,https://www.crunchbase.com/organization/colab-software,Pre-Seed,150000,USD,150000,2019-08-19,,,,CoLab Software is developing modern collaboration technologies for the mechanical design industry.,"Computer, Software","St. John's, Newfoundland, Canada, North America",https://www.colabsoftware.com/,Less than $1M,Seed,"Creative Destruction Lab, Y Combinator"
Seed Round - Lofty AI,https://www.crunchbase.com/funding_round/lofty-ai-seed--b7e60edf,Lofty AI,https://www.crunchbase.com/organization/lofty-ai,Seed,800000,USD,800000,2019-08-19,,,,Lofty AI invests in single family homes vetted by their proprietary A.I.,"Artificial Intelligence, Real Estate","Marina Del Rey, California, United States, North America",https://www.lofty.ai/,,Seed,"Jason Calacanis, Rebel Fund, Y Combinator"
Seed Round - Athlane,https://www.crunchbase.com/funding_round/athlane-seed--4d674443,Athlane,https://www.crunchbase.com/organization/athlane,Seed,150000,USD,150000,2019-08-19,,,,Athlane facilitates sponsorship and endorsement deals between streamers and brands.,"Computer, eSports, Gaming, Marketplace","San Francisco, California, United States, North America",https://www.athlane.com/,,Seed,"ACE & Company, Jonathan Kraft, Kevin Ryan, Romulus Capital, Sacramento Kings, Soma Capital, Y Combinator"
Seed Round - Dashblock,https://www.crunchbase.com/funding_round/dashblock-seed--d7cd621a,Dashblock,https://www.crunchbase.com/organization/dashblock,Seed,150000,USD,150000,2019-08-19,,,,Turn any website into an API,"Data Integration, Internet, Productivity Tools","San Francisco, California, United States, North America",https://dashblock.com/,,Seed,"ACE & Company, Y Combinator"
Seed Round - Apero Health,https://www.crunchbase.com/funding_round/apéro-health-seed--c5989e07,Apero Health,https://www.crunchbase.com/organization/apéro-health,Seed,150000,USD,150000,2019-08-19,,,,Apero Health is a tech-focused medical billing company that gives greater control to practices and patients about their medical payments.,"Fitness, Health Care, Wellness","San Francisco, California, United States, North America",https://www.aperohealth.com/,Less than $1M,Seed,"Nnamdi Okike, UpHonest Capital, Wei Guo, Y Combinator"
Seed Round - Basis,https://www.crunchbase.com/funding_round/basis-588a-seed--7a8e713e,Basis,https://www.crunchbase.com/organization/basis-588a,Seed,150000,USD,150000,2019-08-19,,,,Basis is an online bid board that helps automate construction workflows.,"Construction, Funding Platform","Arcadia, California, United States, North America",https://www.basisboard.com/,,Seed,"Edward Lando, Y Combinator"
Seed Round - Carry,https://www.crunchbase.com/funding_round/carry-4a91-seed--e8360aff,Carry,https://www.crunchbase.com/organization/carry-4a91,Seed,150000,USD,150000,2019-08-19,,,,"Carry plans, books, and supports corporate travel for all your employees over Slack, email, and SMS.","Social Network, Software, Travel","San Francisco, California, United States, North America",https://carry.travel/,,Seed,"Daintree.VC, Y Combinator"
Pre Seed Round - Mightyapp,https://www.crunchbase.com/funding_round/mightyapp-pre-seed--ab4a8342,Mightyapp,https://www.crunchbase.com/organization/mightyapp,Pre-Seed,150000,USD,150000,2019-08-19,,,,Mighty makes Google Chrome faster & use 10x less memory.,"Apps, Web Apps","San Francisco, California, United States, North America",https://mightyapp.com,,Seed,Y Combinator
Seed Round - Tranqui,https://www.crunchbase.com/funding_round/tranqui-seed--f246afa1,Tranqui,https://www.crunchbase.com/organization/tranqui,Seed,150000,USD,150000,2019-08-19,,,,Tranqui is a digital financial advisor that combines technology with financial planning to help people make better financial decisions.,"Finance, Financial Services, FinTech","Cali, Valle del Cauca, Colombia, South America",https://tranquifinanzas.com/,$1M to $10M,Seed,Y Combinator
Pre Seed Round - The Custom Movement,https://www.crunchbase.com/funding_round/hotline-2-pre-seed--7da06145,The Custom Movement,https://www.crunchbase.com/organization/hotline-2,Pre-Seed,150000,USD,150000,2019-08-19,,,,The Custom Movement is a Messaging and getting exclusive updates from the celebrities you love startup.,Messaging,"Petaling Jaya, Selangor, Malaysia, Asia",https://www.thecustommovement.com/,$1M to $10M,Seed,Y Combinator
Seed Round - Volk Fi,https://www.crunchbase.com/funding_round/volk-fi-seed--462097e1,Volk Fi,https://www.crunchbase.com/organization/volk-fi,Seed,,,,2019-08-19,,,,Volk Fi is a startup company that is making distributed network smartphone.,"Consumer Electronics, Electronics, Telecommunications","San Francisco, California, United States, North America",https://www.volkfi.com,$1M to $10M,Seed,Y Combinator
Pre Seed Round - Multis,https://www.crunchbase.com/funding_round/multis-pre-seed--2a0197d3,Multis,https://www.crunchbase.com/organization/multis,Pre-Seed,150000,USD,150000,2019-08-19,,,,"Multis provides financial services for companies holding euros, dollars, and cryptocurrencies. We are building the best crypto wallet designed for businesses who need to scale, move fast, make the most of their crypto and fiat currencies.We're helping these companies embrace cryptocurrencies and shape a global and borderless economy.","Blockchain, Consulting, Cryptocurrency, FinTech, Human Resources, Information Technology, Insurance, Internet, Software, Venture Capital","San Francisco, California, United States, North America",https://multis.co,$1M to $10M,Seed,Y Combinator
Pre Seed Round - Preclusio,https://www.crunchbase.com/funding_round/preclusio-pre-seed--7737a7ff,Preclusio,https://www.crunchbase.com/organization/preclusio,Pre-Seed,150000,USD,150000,2019-08-19,,,,Preclusio develops software that helps companies comply with privacy regulations.,"Cyber Security, Privacy, Software","Redwood City, California, United States, North America",https://www.preclus.io/,$1M to $10M,Seed,Y Combinator
Seed Round - Flux QR,https://www.crunchbase.com/funding_round/flux-3dc6-seed--e90c481c,Flux QR,https://www.crunchbase.com/organization/flux-3dc6,Seed,150000,USD,150000,2019-08-19,,,,"Flux QR is a financial services company that specializes in the fields of mobile payments, fintech, and POS technology.","Financial Services, FinTech, Mobile Payments","Mexico City, Distrito Federal, Mexico, North America",http://paywithflux.com/,,Seed,Y Combinator
Seed Round - Supernova Studio,https://www.crunchbase.com/funding_round/supernova-technology-ltd-seed--98b7717d,Supernova Studio,https://www.crunchbase.com/organization/supernova-technology-ltd,Seed,,,,2019-08-19,,,,"Supernova converts mobile designs to production-ready code, saving about 30% of development time on each mobile application.","Apps, Developer Tools, Information Services, Information Technology, Mobile","Prague, Hlavni mesto Praha, Czech Republic, Europe",https://supernova.io,,Seed,Y Combinator
Seed Round - Prenda,https://www.crunchbase.com/funding_round/prenda-seed--5926a55d,Prenda,https://www.crunchbase.com/organization/prenda,Seed,150000,USD,150000,2019-08-19,,,,"Prenda is an ed-tech company with the vision of helping young people learn technology in a fun, informal settings.","E-Learning, EdTech, Education, Internet","Mesa, Arizona, United States, North America",http://prenda.co,$1M to $10M,,Y Combinator
Pre Seed Round - Hype and Vice,https://www.crunchbase.com/funding_round/hype-and-vice-pre-seed--d4de1078,Hype and Vice,https://www.crunchbase.com/organization/hype-and-vice,Pre-Seed,150000,USD,150000,2019-08-19,,,,Hype and Vice combines on-trend fashion with University brands to create apparel women actually want to wear.,"E-Commerce, Education, Fashion, Lifestyle, Retail","Los Angeles, California, United States, North America",http://www.hypeandvice.com,Less than $1M,Seed,Y Combinator
Seed Round - Draftbit,https://www.crunchbase.com/funding_round/draftbit-seed--8eb359c1,Draftbit,https://www.crunchbase.com/organization/draftbit,Seed,150000,USD,150000,2019-08-19,,,,"Draftbit is a new way to build cross-platform, native iOS and Android apps.","Android, iOS, Mobile, Software","Chicago, Illinois, United States, North America",https://draftbit.com/,Less than $1M,Seed,Y Combinator
Seed Round - Museum of Future Experiences,https://www.crunchbase.com/funding_round/museum-of-future-experiences-seed--4438f29c,Museum of Future Experiences,https://www.crunchbase.com/organization/museum-of-future-experiences,Seed,150000,USD,150000,2019-08-19,,,,Museum of Future Experiences is an entertainment company that crafts and distributes VR experiences.,"Media and Entertainment, Theatre, Virtual Reality","New York, New York, United States, North America",https://www.themofe.com/,,Seed,Y Combinator
Seed Round - Chaser,https://www.crunchbase.com/funding_round/chaser-23bf-seed--24855877,Chaser,https://www.crunchbase.com/organization/chaser-23bf,Seed,,,,2019-08-19,,,,"Your success playbook. Simple, elegant, and delightful workflow tools for Customer Success teams.","Apps, Information Technology","San Francisco, California, United States, North America",https://www.usechaser.com,,Seed,Y Combinator
Seed Round - Binks,https://www.crunchbase.com/funding_round/binks-seed--8d962236,Binks,https://www.crunchbase.com/organization/binks,Seed,150000,USD,150000,2019-08-19,,,,Binks is a modern online clothing store for Indian women.,"E-Commerce, Fashion, Product Design, Retail","Bengaluru, Karnataka, India, Asia",https://getbinks.com/,,Seed,Y Combinator
Pre Seed Round - Wanderlog,https://www.crunchbase.com/funding_round/travelchime-pre-seed--8dce202c,Wanderlog,https://www.crunchbase.com/organization/travelchime,Pre-Seed,,,,2019-08-19,,,,"Wanderlog allows users to choose, organize, and map places in a Google Doc built just for travel planning.",Travel,"San Francisco, California, United States, North America",https://wanderlog.com/,$1M to $10M,Seed,Y Combinator
Pre Seed Round - Simmer,https://www.crunchbase.com/funding_round/simmer-pre-seed--f60622fd,Simmer,https://www.crunchbase.com/organization/simmer,Pre-Seed,150000,USD,150000,2019-08-19,,,,Simmer is a food review app that aims to bring high quality reviews for every dish on the menu.,"Artificial Intelligence, Consumer Reviews, Food and Beverage, Mobile Apps, Restaurants","Tustin, California, United States, North America",https://www.usesimmer.com/,,Seed,"Kenneth Bok, Y Combinator"
Seed Round - Wallet.ng,https://www.crunchbase.com/funding_round/wallet-ng-seed--b20e1401,Wallet.ng,https://www.crunchbase.com/organization/wallet-ng,Seed,,,,2019-08-19,,,,"Wallet.ng is a fintech startup that allows people and companies to send, receive, and make payments, using their phone numbers.","E-Commerce, Financial Services, FinTech, Infrastructure, Mobile, Mobile Payments, Payments","Lagos, Lagos, Nigeria, Africa",https://wallet.ng/,Less than $1M,,Y Combinator
Seed Round - Elph Network,https://www.crunchbase.com/funding_round/elph-seed--17b06a59,Elph Network,https://www.crunchbase.com/organization/elph,Seed,,,,2019-08-19,,,,Elph is a decentralized network of scalable Plasma sidechains that achieve high transaction throughput on top of Ethereum.,"Blockchain, Cryptocurrency, FinTech, Software","San Francisco, California, United States, North America",https://elph.com,,M&A,Y Combinator
Pre Seed Round - Wasmer,https://www.crunchbase.com/funding_round/wasmer-pre-seed--cea08b81,Wasmer,https://www.crunchbase.com/organization/wasmer,Pre-Seed,150000,USD,150000,2019-08-19,,,,Wasmer provides a way to execute WebAssembly files universally,Software,"San Francisco, California, United States, North America",https://wasmer.io,,Seed,Y Combinator
Pre Seed Round - Hey Healthcare,https://www.crunchbase.com/funding_round/hey-healthcare-pre-seed--57822968,Hey Healthcare,https://www.crunchbase.com/organization/hey-healthcare,Pre-Seed,150000,USD,150000,2019-08-19,,,,Hey Healthcare provides healthcare software designed to automate medical billing.,"Apps, Health Care, Information Technology, Insurance, Software","San Francisco, California, United States, North America",https://heyhealthcare.com/,,Seed,Y Combinator
Seed Round - InEvent,https://www.crunchbase.com/funding_round/inevent-seed--70b82f81,InEvent,https://www.crunchbase.com/organization/inevent,Seed,1000000,USD,1000000,2019-08-19,,,,"Virtual, online and hybrid events, meetings and conferences","Apps, Enterprise Software, Event Management, Information Technology, Internet, SaaS","Atlanta, Georgia, United States, North America",https://inevent.com/,$1M to $10M,Seed,"Rebel Fund, Y Combinator"
Seed Round - Figments,https://www.crunchbase.com/funding_round/figments-seed--7560300b,Figments,https://www.crunchbase.com/organization/figments,Seed,150000,USD,150000,2019-08-19,,,,Figments is the next version of the WWE for esports.,"Digital Entertainment, Gaming, Sports","Mountain View, California, United States, North America",https://figments.gg/,,Seed,Y Combinator
Pre Seed Round - Coco Mercado,https://www.crunchbase.com/funding_round/coco-mercado-pre-seed--7022349c,Coco Mercado,https://www.crunchbase.com/organization/coco-mercado,Pre-Seed,150000,USD,150000,2019-08-19,,,,Coco allows the more than 4 million Venezuelan expats worldwide to send food to their families back home in less than 24 hours.,"Assistive Technology, Consumer Goods, Mobile Apps, Social Assistance","San Francisco, California, United States, North America",https://www.cocomercado.com/,Less than $1M,Seed,Y Combinator
Seed Round - Covela,https://www.crunchbase.com/funding_round/covela-seed--d747bb16,Covela,https://www.crunchbase.com/organization/covela,Seed,150000,USD,150000,2019-08-19,,,,Digital broker for SMEs in Mexico,"FinTech, InsurTech","Mexico City, Distrito Federal, Mexico, North America",https://covela.mx/,$1M to $10M,Seed,Y Combinator
Seed Round - Modoo,https://www.crunchbase.com/funding_round/modoo-technology-seed--7117f3a0,Modoo,https://www.crunchbase.com/organization/modoo-technology,Seed,,,,2019-08-19,,,,"Modoo Technology is a wearable for monitoring fetal health, measuring heart rate and baby movements.","Electronics, Health Care, Home Health Care, Wearables","Beijing, Beijing, China, Asia",http://www.modoo.life/,$1M to $10M,Seed,Y Combinator
Pre Seed Round - Gamebytes,https://www.crunchbase.com/funding_round/fad-mania-pre-seed--5760b1d1,Gamebytes,https://www.crunchbase.com/organization/fad-mania,Pre-Seed,150000,USD,150000,2019-08-19,,,,iMessage Games with Friends,Digital Entertainment,"San Francisco, California, United States, North America",https://www.gamebytes.io/,,Seed,Y Combinator
Seed Round - Metsä Group,https://www.crunchbase.com/funding_round/metsä-group-seed--6d292d95,Metsä Group,https://www.crunchbase.com/organization/metsä-group,Seed,150000,USD,150000,2019-08-19,,,,Metsä Group is a forerunner in sustainable bioeconomy utilising renewable wood from sustainably managed northern forests.,"Biotechnology, Paper Manufacturing","Espoo, Southern Finland, Finland, Europe",https://www.metsagroup.com/,$1M to $10M,Seed,Y Combinator
Seed Round - Instapath,https://www.crunchbase.com/funding_round/instapath-inc-seed--b735c5ce,Instapath,https://www.crunchbase.com/organization/instapath-inc,Seed,,,,2019-08-19,,,,Instapath provides digital imaging tools for rapid on-site pathology evaluation to repeat biopsy procedures and increase hospital revenue.,"Biotechnology, Health Care, Medical, Medical Device","Houston, Texas, United States, North America",http://www.instapathbio.com,Less than $1M,,Y Combinator
Pre Seed Round - Gmelius,https://www.crunchbase.com/funding_round/gmelius-pre-seed--a917be01,Gmelius,https://www.crunchbase.com/organization/gmelius,Pre-Seed,150000,USD,150000,2019-08-19,,,,We are the first SaaS collaboration platform that lives inside Google Workspace (formerly G Suite) and your daily tools.,"Collaboration, CRM, Email, Productivity Tools, Software","Geneva, Geneve, Switzerland, Europe",https://gmelius.com,Less than $1M,Seed,Y Combinator
Venture Round - ZeroDown,https://www.crunchbase.com/funding_round/zerodown-series-unknown--c7b3d8cb,ZeroDown,https://www.crunchbase.com/organization/zerodown,Venture - Series Unknown,,,,2019-08-19,,,,ZeroDown is a real estate startup that focuses on providing an affordable homeownership solution.,"Real Estate, Rental Property, Service Industry, Travel","San Francisco, California, United States, North America",https://zerodown.com,$1M to $10M,,Y Combinator
Seed Round - EncepHeal Therapeutics,https://www.crunchbase.com/funding_round/encepheal-therapeutics-seed--5a2701c8,EncepHeal Therapeutics,https://www.crunchbase.com/organization/encepheal-therapeutics,Seed,150000,USD,150000,2019-08-19,,,,EncepHeal Therapeutics enhances the development of first-in-class medicines to improve treatment of mental health disorders.,"Health Care, Therapeutics","Winston Salem, North Carolina, United States, North America",http://encepheal.com/,,Seed,Y Combinator
Pre Seed Round - Khabri,https://www.crunchbase.com/funding_round/khabri-pre-seed--5a0d22ca,Khabri,https://www.crunchbase.com/organization/khabri,Pre-Seed,150000,USD,150000,2019-08-19,,,,Khabri is a digital audio platform for content in vernacular.,"Apps, Audio","Haryana, Haryana, India, Asia",https://khabri.app/,,Seed,Y Combinator
Pre Seed Round - Elpha,https://www.crunchbase.com/funding_round/elpha-pre-seed--3ad84810,Elpha,https://www.crunchbase.com/organization/elpha,Pre-Seed,150000,USD,150000,2019-08-19,,,,Where women in tech talk candidly online,Communities,"San Francisco, California, United States, North America",https://elpha.com/,Less than $1M,Seed,Y Combinator
Pre Seed Round - GradJoy,https://www.crunchbase.com/funding_round/gradjoy-pre-seed--b66c9cfe,GradJoy,https://www.crunchbase.com/organization/gradjoy,Pre-Seed,150000,USD,150000,2019-08-19,,,,GradJoy manages your student loans — helping you save money and be debt-free faster.,"Education, Financial Services, FinTech","Austin, Texas, United States, North America",https://gradjoy.com,,Seed,Y Combinator
Seed Round - Saratoga Energy Corporation,https://www.crunchbase.com/funding_round/saratoga-energy-research-partners-seed--910f1b8d,Saratoga Energy Corporation,https://www.crunchbase.com/organization/saratoga-energy-research-partners,Seed,,,,2019-08-19,,,,Developing an inexpensive production process,"Automotive, Chemical, Electronics, Energy, Manufacturing, Renewable Energy","Berkeley, California, United States, North America",http://www.saratoga-energy.com,Less than $1M,Seed,Y Combinator
