Seed Round - RingMD,https://www.crunchbase.com/funding_round/ringmd-seed--90af217a,RingMD,https://www.crunchbase.com/organization/ringmd,Seed,125000,USD,125000,2020-08-25,,,,RingMD is a healthcare network designed to connect patients with medical doctors and wellness practitioners independently of location.,"Apps, Health Care, Medical","Singapore, Central Region, Singapore, Asia",https://ring.md,$1M to $10M,Seed,Y Combinator
Seed Round - Sutra Fitness,https://www.crunchbase.com/funding_round/sutra-c1ed-seed--ad765f08,Sutra Fitness,https://www.crunchbase.com/organization/sutra-c1ed,Seed,125000,USD,125000,2020-08-25,,,,Sutra makes it easy for fitness instructors to build an online business.,"Fitness, Health Care, Wellness","Los Angeles, California, United States, North America",https://sutra.fit/,Less than $1M,Seed,Y Combinator
Seed Round - Batch.sh,https://www.crunchbase.com/funding_round/batch-sh-seed--6a18d34e,Batch.sh,https://www.crunchbase.com/organization/batch-sh,Seed,125000,USD,125000,2020-08-25,,,,Batch allows customers to observe and replay data inside messaging systems to help them quickly diagnose outages and data disasters.,"Developer Tools, Events","Portland, Oregon, United States, North America",https://batch.sh/,,Seed,Y Combinator
Seed Round - Opvia,https://www.crunchbase.com/funding_round/opvia-seed--8bb40c64,Opvia,https://www.crunchbase.com/organization/opvia,Seed,125000,USD,125000,2020-08-25,,,,Opvia is a developer of a biotechnology platform intended to reduce the time taken to develop bio-processes.,"B2B, Biopharma, Biotechnology","London, England, United Kingdom, Europe",https://www.opvia.bio,,Seed,Y Combinator
Seed Round - Synth,https://www.crunchbase.com/funding_round/synth-seed--70839525,Synth,https://www.crunchbase.com/organization/synth,Seed,150000,USD,150000,2020-08-25,,,,Synthetic data for quicker and privacy compliant development and testing,"Analytics, Developer APIs, Software, Software Engineering","London, England, United Kingdom, Europe",https://www.getsynth.com/,Less than $1M,Seed,Y Combinator
Seed Round - VenoStent,https://www.crunchbase.com/funding_round/venostent-seed--6f4885b9,VenoStent,https://www.crunchbase.com/organization/venostent,Seed,150000,USD,150000,2020-08-25,,,,"VenoStent is biomaterials company developing bioresorbable, smart polymers to transform vascular surgery.","Advanced Materials, Health Care, Medical Device","Nashville, Tennessee, United States, North America",http://www.venostent.com,Less than $1M,Seed,Y Combinator
Seed Round - Cradle,https://www.crunchbase.com/funding_round/cradle-aef2-seed--d1ce2a39,Cradle,https://www.crunchbase.com/organization/cradle-aef2,Seed,125000,USD,125000,2020-08-25,,,,Cradle is a provider of a one-stop-shop for all your business financing needs.,"Customer Service, Finance, Financial Services, Payments","Mumbai, Maharashtra, India, Asia",https://www.cradlefinance.com/,,Seed,Y Combinator
Seed Round - Afriex,https://www.crunchbase.com/funding_round/afriex-seed--bc07a7ef,Afriex,https://www.crunchbase.com/organization/afriex,Seed,125000,USD,125000,2020-08-25,,,,Afriex is a pioneering platform that allows its users to send and receive money to anybody around the globe.,"Finance, Financial Exchanges, Financial Services, Information Technology","Oakland, California, United States, North America",https://www.afriexapp.com/,Less than $1M,Seed,Y Combinator
Seed Round - Nestybox,https://www.crunchbase.com/funding_round/nestybox-seed--653e98f0,Nestybox,https://www.crunchbase.com/organization/nestybox,Seed,125000,USD,125000,2020-08-25,,,,"Nestybox specializes in software development, linux, application development, OS virtualization and IT services.","Apps, Linux, Software","San Jose, California, United States, North America",https://www.nestybox.com/,Less than $1M,Seed,Y Combinator
Seed Round - Epihub,https://www.crunchbase.com/funding_round/epihub-seed--cdadac4e,Epihub,https://www.crunchbase.com/organization/epihub,Seed,125000,USD,125000,2020-08-25,,,,Epihub develops a computer platform designed to automate assessments from students.,"E-Learning, Education, Software","New York, New York, United States, North America",https://epihub.com/,,Seed,Y Combinator
Seed Round - Speedscale,https://www.crunchbase.com/funding_round/speedscale-seed--a1d1ecbe,Speedscale,https://www.crunchbase.com/organization/speedscale,Seed,125000,USD,125000,2020-08-25,,,,Speedscale develops a test automation solution that helps dev teams fix application issues before release.,"Developer APIs, Information Technology, Productivity Tools, SaaS, Software, Test and Measurement, Usability Testing","Atlanta, Georgia, United States, North America",https://speedscale.com/,,Seed,Y Combinator
Seed Round - DigitalBrain,https://www.crunchbase.com/funding_round/digital-brain-seed--8313053f,DigitalBrain,https://www.crunchbase.com/organization/digital-brain,Seed,150000,USD,150000,2020-08-25,,,,Digital Brain helps you get through your support tickets twice as fast.,"Information Services, Information Technology","San Francisco, California, United States, North America",https://digitalbrain.app,,Seed,Y Combinator
Seed Round - Oco Meals,https://www.crunchbase.com/funding_round/ocomeals-seed--cb4d4a61,Oco Meals,https://www.crunchbase.com/organization/ocomeals,Seed,125000,USD,125000,2020-08-25,,,,Oco Meals delivers ready-to-eat meals at the doorstep on a weekly basis.,"Food and Beverage, Food Delivery, Restaurants","Vancouver, British Columbia, Canada, North America",https://ocomeals.com/,Less than $1M,Seed,Y Combinator
Seed Round - Daybreak Health,https://www.crunchbase.com/funding_round/daybreak-health-seed--1b053148,Daybreak Health,https://www.crunchbase.com/organization/daybreak-health,Seed,125000,USD,125000,2020-08-25,,,,"Daybreak Health specializes in providing online counseling services, especially for teens, helping to stabilize their mental fitness.","Health Care, Mobile Apps, Personal Health, Therapeutics, Wellness","San Francisco, California, United States, North America",https://www.daybreakhealth.com/,Less than $1M,Seed,Y Combinator
Pre Seed Round - Notabene,https://www.crunchbase.com/funding_round/notabene-86d2-pre-seed--15d68674,Notabene,https://www.crunchbase.com/organization/notabene-86d2,Pre-Seed,150000,USD,150000,2020-08-25,,,,Notabene helps businesses perform crypto transactions that are regulatory compliant.,"Blockchain, Cryptocurrency, FinTech","New York, New York, United States, North America",https://notabene.id,Less than $1M,Seed,Y Combinator
Seed Round - SafeBase,https://www.crunchbase.com/funding_round/safebase-ffd0-seed--e2f95c21,SafeBase,https://www.crunchbase.com/organization/safebase-ffd0,Seed,125000,USD,125000,2020-08-25,,,,SafeBase helps B2B SaaS companies close enterprise deals faster by streamlining the security assessment process.,"Cloud Security, Cyber Security, Network Security, SaaS, Sales Automation","San Francisco, California, United States, North America",https://www.safebase.co/,,Seed,Y Combinator
Seed Round - Tangobuilder,https://www.crunchbase.com/funding_round/tangobuilder-seed--d3abad25,Tangobuilder,https://www.crunchbase.com/organization/tangobuilder,Seed,125000,USD,125000,2020-08-25,,,,"Tangobuilder platform gives engineers, architects, and contractors the accurate and customized design information they need.","Civil Engineering, Construction","San Jose, California, United States, North America",https://www.tangobuilder.com/,,Seed,Y Combinator
Seed Round - Clover,https://www.crunchbase.com/funding_round/clover-440b-seed--3d0608ab,Clover,https://www.crunchbase.com/organization/clover-440b,Seed,125000,USD,125000,2020-08-25,,,,"Clover is the all-in-one notebook that allows you to brainstorm, write, and plan in a visual way.","Document Management, Information Technology, Product Design, Software","New York, New York, United States, North America",https://cloverapp.co/,Less than $1M,Seed,Y Combinator
Seed Round - Trident Bioscience,https://www.crunchbase.com/funding_round/trident-bioscience-seed--db437115,Trident Bioscience,https://www.crunchbase.com/organization/trident-bioscience,Seed,125000,USD,125000,2020-08-25,,,,Trident Bioscience is a biotech company that stays abreast of the latest technological trends in leading protein structure.,"Biotechnology, Life Science, Therapeutics","Mountain View, California, United States, North America",https://www.trident.bio/,Less than $1M,Seed,Y Combinator
Seed Round - Roboflow,https://www.crunchbase.com/funding_round/roboflow-seed--401d20d1,Roboflow,https://www.crunchbase.com/organization/roboflow,Seed,125000,USD,125000,2020-08-25,,,,Roboflow is a developer tool for building computer vision models faster and more accurately.,"Artificial Intelligence, Computer Vision, Developer Tools","Des Moines, Iowa, United States, North America",https://roboflow.com/,,Seed,Y Combinator
Seed Round - Bits,https://www.crunchbase.com/funding_round/fea-card-seed--010fe284,Bits,https://www.crunchbase.com/organization/fea-card,Seed,125000,USD,125000,2020-08-25,,,,Bits helps people build their credit score by providing them with a digital credit card that they pay off every month.,"Credit Cards, FinTech, Internet, Mobile Apps","London, England, United Kingdom, Europe",https://www.getbits.app,$1M to $10M,Seed,Y Combinator
Seed Round - Plum Mail,https://www.crunchbase.com/funding_round/plummail-seed--3f9e2ade,Plum Mail,https://www.crunchbase.com/organization/plummail,Seed,150000,USD,150000,2020-08-25,,,,Plum Mail is an alternative email solution that lets users do more from their existing email addresses.,"Email, Information and Communications Technology (ICT), Messaging","Exeter, Devon, United Kingdom, Europe",https://plummail.co/,Less than $1M,Seed,Y Combinator
Seed Round - Tyltgo,https://www.crunchbase.com/funding_round/tyltgo-seed--d542b902,Tyltgo,https://www.crunchbase.com/organization/tyltgo,Seed,125000,USD,125000,2020-08-25,,,,"Tyltgo provides courier, logistics, supply chain management, and delivery services for small businesses and enterprises.","Delivery Service, Logistics, Supply Chain Management","Kitchener, Ontario, Canada, North America",https://www.tyltgo.com/,Less than $1M,Seed,Y Combinator
Seed Round - CapWay,https://www.crunchbase.com/funding_round/capway-seed--1bf5cbb7,CapWay,https://www.crunchbase.com/organization/capway,Seed,125000,USD,125000,2020-08-25,,,,CapWay is a digital bank creating financial access and opportunities for everyone.,"Banking, Financial Services, FinTech, Mobile Apps","Atlanta, Georgia, United States, North America",http://CapWay.co,$1M to $10M,Seed,Y Combinator
Seed Round - Porter,https://www.crunchbase.com/funding_round/porter-0eee-seed--0d19714d,Porter,https://www.crunchbase.com/organization/porter-0eee,Seed,125000,USD,125000,2020-08-25,,,,"Porter primarily focuses on developing remote dev environments that allow users to run, optimize & build solutions without local constraint.","Information Technology, Internet, Software, Software Engineering","New York, New York, United States, North America",https://www.getporter.dev/,,Seed,Y Combinator
Seed Round - Dripos,https://www.crunchbase.com/funding_round/drip-650c-seed--e4ac19fc,Dripos,https://www.crunchbase.com/organization/drip-650c,Seed,125000,USD,125000,2020-08-25,,,,Dripos is the only piece of software a restaurant needs to operate.,"Consumer Software, Restaurants, SaaS, Software","Boston, Massachusetts, United States, North America",https://www.dripos.com,,Seed,Y Combinator
Seed Round - Scrimba,https://www.crunchbase.com/funding_round/scrimba-seed--178924f4,Scrimba,https://www.crunchbase.com/organization/scrimba,Seed,125000,USD,125000,2020-08-25,,,,Scrimba teaches students coding through interactive videos that are pre-recorded.,"E-Learning, Education, Loyalty Programs","Oslo, Oslo, Norway, Europe",https://scrimba.com/,Less than $1M,Seed,Y Combinator
Seed Round - Rume,https://www.crunchbase.com/funding_round/rume-a4c3-seed--30f0bf88,Rume,https://www.crunchbase.com/organization/rume-a4c3,Seed,125000,USD,125000,2020-08-25,,,,Rume is an online video platform that allows users to have multiple conversations as well as play games at the same time.,"Information Technology, Video Chat, Web Apps","San Francisco, California, United States, North America",https://rumevideo.com/,Less than $1M,Seed,Y Combinator
Seed Round - Supabase,https://www.crunchbase.com/funding_round/supabase-seed--95471dfe,Supabase,https://www.crunchbase.com/organization/supabase,Seed,125000,USD,125000,2020-08-25,,,,Supabase is a developer of developer tools' suite intended to handle repetitive workflow.,"Database, Developer Tools, Information Services, Information Technology, Software","Singapore, Central Region, Singapore, Asia",https://supabase.io/,$1M to $10M,Seed,Y Combinator
Seed Round - Orchata,https://www.crunchbase.com/funding_round/orchata-seed--e5f13ba5,Orchata,https://www.crunchbase.com/organization/orchata,Seed,125000,USD,125000,2020-08-25,,,,"Orchata offers e-commerce platforms to grocery, meat, produce & seafood suppliers by digitally transforming the businesses to run smoothly.","E-Commerce, E-Commerce Platforms, Information Technology","Monterrey, Nuevo Leon, Mexico, North America",https://www.orchata.com/,,Seed,Y Combinator
Pre Seed Round - Parade,https://www.crunchbase.com/funding_round/parade-0c56-pre-seed--8309f2f4,Parade,https://www.crunchbase.com/organization/parade-0c56,Pre-Seed,125000,USD,125000,2020-08-25,,,,"Parade creates unique marketing materials that include style guides, marketing emails, social media posts, and branding.","Advertising, Brand Marketing, Enterprise Software, Marketing Automation, Social Media Marketing","Jackson, Wyoming, United States, North America",https://www.getparade.com/,Less than $1M,Seed,Y Combinator
Seed Round - Ukama,https://www.crunchbase.com/funding_round/ukama-seed--d84f2a75,Ukama,https://www.crunchbase.com/organization/ukama,Seed,150000,USD,150000,2020-08-25,,,,"Cellular network built for you, by you","Cloud Management, Hardware, Internet, Open Source, Telecommunications","Pleasanton, California, United States, North America",https://www.ukama.com/,,Seed,Y Combinator
Pre Seed Round - Chatpay,https://www.crunchbase.com/funding_round/chatpay-f008-pre-seed--db89c968,Chatpay,https://www.crunchbase.com/organization/chatpay-f008,Pre-Seed,125000,USD,125000,2020-08-25,,,,ChatPay helps talented people to easily monetize their content in WhatsApp and Telegram groups.,"Computer, Software","Nova Lima, Minas Gerais, Brazil, South America",https://www.chatpay.com.br,$1M to $10M,Seed,"Rodrigo Dantas, Y Combinator"
Seed Round - Evergreen,https://www.crunchbase.com/funding_round/evergreen-5f5c-seed--c864114e,Evergreen,https://www.crunchbase.com/organization/evergreen-5f5c,Seed,125000,USD,125000,2020-08-25,,,,Evergreen is a pioneering platform that offers an intuitive path by allowing employees to request purchases and track approvals.,"Compliance, Enterprise Resource Planning (ERP), Finance, Information Technology, Software","San Francisco, California, United States, North America",https://tryevergreen.com/,,Seed,Y Combinator
Seed Round - Reploy,https://www.crunchbase.com/funding_round/reploy-seed--792c784a,Reploy,https://www.crunchbase.com/organization/reploy,Seed,125000,USD,125000,2020-08-25,,,,"Reploy is the easiest way to generate unique production-like environments for every feature, complete with a shareable link.","Developer Tools, Information Technology","San Francisco, California, United States, North America",https://getreploy.com/,,Seed,Y Combinator
Pre Seed Round - Plerk,https://www.crunchbase.com/funding_round/plerk-pre-seed--1378c345,Plerk,https://www.crunchbase.com/organization/plerk,Pre-Seed,150000,USD,150000,2020-08-25,,,,Where fintech meets human resources. A virtual card with benefits to pay for flexible perks worldwide.,"Employee Benefits, Enterprise Software, Financial Services, FinTech, Human Resources, Wellness","Guadalajara, Jalisco, Mexico, North America",https://www.plerk.io/#/,,Seed,Y Combinator
Seed Round - ilk,https://www.crunchbase.com/funding_round/ilk-seed--e6b7c08b,ilk,https://www.crunchbase.com/organization/ilk,Seed,125000,USD,125000,2020-08-25,,,,ilk is a marketplace that helps parents set up shared child care in their homes.,"Child Care, Education, Health Care, Marketplace","San Francisco, California, United States, North America",https://ilk.io/,Less than $1M,Seed,Y Combinator
Seed Round - SuperTokens,https://www.crunchbase.com/funding_round/supertokens-seed--f9851ae0,SuperTokens,https://www.crunchbase.com/organization/supertokens,Seed,150000,USD,150000,2020-08-25,,,,"SuperTokens offers an open source authentication - as an alternative to Auth0, Okta, Firebase Auth and AWS Cognito","Network Security, Software","New York, New York, United States, North America",https://supertokens.io/,$1M to $10M,Seed,Y Combinator
Seed Round - Parrot Software,https://www.crunchbase.com/funding_round/parrot-software-1f71-seed--ac66a9f2,Parrot Software,https://www.crunchbase.com/organization/parrot-software-1f71,Seed,125000,USD,125000,2020-08-25,,,,"Parrot Software helps restaurants migrate their systems to their own platform to provide the latest technologies, like automates sales.","Restaurants, Service Industry, Software","Monterrey, Nuevo Leon, Mexico, North America",https://www.parrotsoftware.io,,Seed,Y Combinator
Seed Round - Safepay,https://www.crunchbase.com/funding_round/safepay-seed--8bfd5956,Safepay,https://www.crunchbase.com/organization/safepay,Seed,125000,USD,125000,2020-08-25,,,,Safepay specializes in digital payments that are secure as well as helps merchants receive payments faster by enabling online payments.,"Mobile Payments, Payments, Transaction Processing","Karachi, Sindh, Pakistan, Asia",https://getsafepay.pk/,Less than $1M,Seed,Y Combinator
Seed Round - Virtually,https://www.crunchbase.com/funding_round/virtually-seed--13c5713c,Virtually,https://www.crunchbase.com/organization/virtually,Seed,125000,USD,125000,2020-08-25,,,,"Virtually is an online school that helps in bridging live conferencing, payment-processing and student management in one place.","E-Learning, Education, Video Conferencing","New York, New York, United States, North America",https://tryvirtually.com/,,Seed,Y Combinator
Seed Round - Matter,https://www.crunchbase.com/funding_round/matter-ec5e-seed--b9632246,Matter,https://www.crunchbase.com/organization/matter-ec5e,Seed,125000,USD,125000,2020-08-25,,,,"Matter is a social reading app for articles, blogs, and newsletters to help users find better content online.","Apps, Content, Content Marketing","San Francisco, California, United States, North America",https://getmatter.app/,,Seed,Y Combinator
Pre Seed Round - Phonic,https://www.crunchbase.com/funding_round/phonic-pre-seed--bceb405f,Phonic,https://www.crunchbase.com/organization/phonic,Pre-Seed,150000,USD,150000,2020-08-25,,,,Phonic is for building beautiful voice and video surveys.,"Market Research, Payments","San Mateo, California, United States, North America",https://www.phonic.ai,,Seed,Y Combinator
Seed Round - Kosmos,https://www.crunchbase.com/funding_round/kosmos-seed--dad0fd59,Kosmos,https://www.crunchbase.com/organization/kosmos,Seed,125000,USD,125000,2020-08-25,,,,"Kosmos offers documentation, microservice catalog, distributed infrastructure and compliance management services in one platform.","Developer Tools, Document Management, Information Services, Information Technology, Infrastructure, Online Portals, SaaS, Software","San Francisco, California, United States, North America",https://usekosmos.com/,,Seed,Y Combinator
Seed Round - Hypotenuse,https://www.crunchbase.com/funding_round/hypotenuse-seed--95285d43,Hypotenuse,https://www.crunchbase.com/organization/hypotenuse,Seed,125000,USD,125000,2020-08-25,,,,"Hypotenuse automatically generates copywriting for e-commerce companies, including product descriptions, advertising text, and blog posts.","Advertising, E-Commerce, Information Services, Information Technology, Product Research","Mountain View, California, United States, North America",https://hypotenuse.ai/,$1M to $10M,Seed,Y Combinator
Seed Round - Cohere,https://www.crunchbase.com/funding_round/cohere-02fd-seed--52803f8c,Cohere,https://www.crunchbase.com/organization/cohere-02fd,Seed,150000,USD,150000,2020-08-25,,,,Cohere is a technology company that develops customer support and onboarding software for businesses.,"SaaS, Software, Technical Support","New York, New York, United States, North America",https://cohere.so/,,Seed,Y Combinator
Non Equity Assistance - Finmark,https://www.crunchbase.com/funding_round/finmark-non-equity-assistance--af2519a4,Finmark,https://www.crunchbase.com/organization/finmark,Non-equity Assistance,125000,USD,125000,2020-08-25,,,,"Finmark is financial planning software for startups; making it simple for companies to manage their runway, hiring, and cash.","Finance, FinTech, Information Technology, SaaS, Software","Raleigh, North Carolina, United States, North America",https://finmark.com,$1M to $10M,Seed,Y Combinator
Seed Round - Yotta Savings,https://www.crunchbase.com/funding_round/yotta-saving-seed--ce395f84,Yotta Savings,https://www.crunchbase.com/organization/yotta-saving,Seed,125000,USD,125000,2020-08-25,,,,Yotta Savings offers free FDIC-insured bank savings accounts and rewards savings account depositors with weekly prize drawings.,"Finance, Financial Services, FinTech","New York, New York, United States, North America",https://withyotta.com/,$1M to $10M,Early Stage Venture,Y Combinator
Seed Round - Reflect,https://www.crunchbase.com/funding_round/reflect-42d0-seed--a397b7c0,Reflect,https://www.crunchbase.com/organization/reflect-42d0,Seed,150000,USD,150000,2020-08-25,,,,Reflect is an automated web testing tool for developers to test their web app without writing a line of code.,"Developer Tools, Productivity Tools, Software","Philadelphia, Pennsylvania, United States, North America",https://reflect.run/,,Seed,Y Combinator
Seed Round - Liyfe,https://www.crunchbase.com/funding_round/liyfe-seed--42d86884,Liyfe,https://www.crunchbase.com/organization/liyfe,Seed,125000,USD,125000,2020-08-25,,,,"Liyfe is a telemedicine platform that specializes in cancer diagnosis, breast cancer treatment and cancer-related resource solutions.","Clinical Trials, Health Care, Health Diagnostics","New York, New York, United States, North America",https://liyfeclinic.com/,$1M to $10M,Seed,Y Combinator
Seed Round - Maytana,https://www.crunchbase.com/funding_round/maytana-seed--1f8d5703,Maytana,https://www.crunchbase.com/organization/maytana,Seed,125000,USD,125000,2020-08-25,,,,Maytana designs a digital platform that consolidates all the business bank accounts with financial tracking and analytics.,"Analytics, Financial Services, FinTech, Predictive Analytics, Software","Lyon, Rhone-Alpes, France, Europe",https://maytana.com/,Less than $1M,Seed,Y Combinator
Seed Round - Dapi,https://www.crunchbase.com/funding_round/dapi-seed--d910e213,Dapi,https://www.crunchbase.com/organization/dapi,Seed,125000,USD,125000,2020-08-25,,,,Dapi is a platform that enables any application to accept payments instantly at near to 0 fees directly from bank accounts.,"Banking, Financial Services, FinTech, Payments","San Francisco, California, United States, North America",https://dapi.co,,Seed,Y Combinator
Seed Round - PhotoRoom,https://www.crunchbase.com/funding_round/photoroom-seed--b123e0be,PhotoRoom,https://www.crunchbase.com/organization/photoroom,Seed,125000,USD,125000,2020-08-25,,,,PhotoRoom is an AI-enabled image capturing app that lets users create studio-quality product pictures in seconds.,"Artificial Intelligence, Mobile Apps, Photo Editing, Photography","Paris, Ile-de-France, France, Europe",https://photoroom.com/,Less than $1M,Seed,Y Combinator
Seed Round - Letter,https://www.crunchbase.com/funding_round/letter-seed--2765da97,Letter,https://www.crunchbase.com/organization/letter,Seed,125000,USD,125000,2020-08-25,,,,Letter is a beautifully designed banking and financial platform made exclusively for high net-worth individuals.,"Financial Services, FinTech, Information Technology, Marketing","San Francisco, California, United States, North America",https://letter.co/,,Seed,Y Combinator
Seed Round - Acho,https://www.crunchbase.com/funding_round/acho-seed--e99222ef,Acho,https://www.crunchbase.com/organization/acho,Seed,125000,USD,125000,2020-08-25,,,,Acho is data warehouse everyone can use.,"Cloud Computing, Cloud Data Services, Cloud Infrastructure, Data Integration, Data Storage, Software","Boston, Massachusetts, United States, North America",http://acho.io,,Seed,Y Combinator
Seed Round - Quell,https://www.crunchbase.com/funding_round/quell-1ffb-seed--4f879ec5,Quell,https://www.crunchbase.com/organization/quell-1ffb,Seed,125000,USD,125000,2020-08-25,,,,Quell delivers a virtual fitness world that offers a unique experience of intense workout while gaming to achieve fitness goals.,"Fitness, Gaming, Information Technology","London, England, United Kingdom, Europe",https://playquell.com,,Seed,Y Combinator
Seed Round - Ramani,https://www.crunchbase.com/funding_round/ramani-seed--95d6ed3f,Ramani,https://www.crunchbase.com/organization/ramani,Seed,150000,USD,150000,2020-08-25,,,,Ramani is expertise in developing software that helps in tracking and managing the sales operation of any organization in real time.,"SaaS, Sales Automation, Software","Dar Es Salaam, Dar es Salaam, Tanzania, Africa",https://www.ramani.io/,,Seed,Y Combinator
